,title,id,upvotes,downs,upvote_ratio,posted_on
0,[OC] Artificial Intelligence hype is currently at its peak. Metaverse rose and fell the quickest.,17bhnjv,8455,0,0.89,2023-10-19
1,ChatGPT is just the beginning: Artificial intelligence is ready to transform the world,10qvt8l,14958,0,0.86,2023-02-01
2,"Please, help me do something with the fear of artificial intelligence",15g6hr4,25,0,0.74,2023-08-02
3,What is the current state of artificial intelligence?,kphki,19,0,0.78,2011-09-23
4,Artificial General Intelligence Is Already Here,175kvrm,338,0,0.81,2023-10-11
5,Photo dump from my therapist’s office……….. hi 🙇🏻‍♀️😵‍💫🤍🦭 Porn? Cats? Literature? Memes? Animatronic beby seal plushes that contain superb artificial intelligence?,uebpye,220,0,1.0,2022-04-28
6,Artificial General Intelligence (AGI) Is One Prompt Away,17hkdjn,106,0,0.8,2023-10-27
7,Anal AI,15pq3qc,20,0,1.0,2023-08-12
8,Using artificial intelligence to reanimate one of the fathers of artificial intelligence,sbjtf9,21059,0,0.95,2022-01-24
9,Google says its artificial intelligence is faster and better than humans at laying out chips for artificial intelligence,nwlik9,16191,0,0.94,2021-06-10
10,"Rise of artificial intelligence is inevitable but should not be feared, ‘father of AI’ says | Artificial intelligence (AI)",13akp0a,2676,0,0.85,2023-05-07
11,The Real Problem With Artificial Intelligence,17a0z3w,14197,0,0.96,2023-10-17
12,Bill Gates warns that artificial intelligence can attack humans,1237hd3,14187,0,0.86,2023-03-26
13,Artificial Intelligence,16s0c38,8041,0,0.98,2023-09-25
14,Performers Worry Artificial Intelligence Will Take Their Jobs,145wx15,4409,0,0.91,2023-06-10
15,The Real Problem With Artificial Intelligence,17j9w3l,14969,0,0.94,2023-10-29
16,Auto valet parking with robots and artificial intelligence in China,149aqec,17744,0,0.94,2023-06-14
17,Artificial intelligence supremacy,ns45vn,36044,0,0.98,2021-06-04
18,Peak Artificial Intelligence Moment,11ju1ww,20569,0,0.97,2023-03-06
19,The technological advancements in artificial intelligence,12x2um8,24864,0,0.98,2023-04-23
20,Artificial intelligence it seems,annovm,28770,0,0.9,2019-02-05
21,Google’s Allegedly Sentient Artificial Intelligence Has Hired An Attorney,vt8du3,15055,0,0.79,2022-07-06
22,Artificial intelligence based translator of American sign language.,o0fpuq,77916,0,0.93,2021-06-15
23,"The Prototype , Mother of all artificial intelligence ",12v0y3r,14266,0,0.98,2023-04-22
24,Which Artificial Intelligence was your favorite?,y8vvwu,2551,0,0.99,2022-10-20
25,I cloned KSI's voice using Artificial Intelligence and made him sus,13y58ob,9704,0,0.96,2023-06-02
26,Goldman Sachs Predicts 300 Million Jobs Will Be Lost Or Degraded By Artificial Intelligence,146crnw,8098,0,0.91,2023-06-10
27,"Ladies and gentlemen, Artificial Intelligence",oyslay,8553,0,0.94,2021-08-05
28,Artificial Intelligence is getting weird,oysozv,7587,0,0.96,2021-08-05
29,Never Give Artificial Intelligence the Nuclear Codes,135oed2,1640,0,0.9,2023-05-02
30,"""advanced artificial-intelligence""",9slhfh,17855,0,0.94,2018-10-30
31,Tech leaders urge a pause in the 'out-of-control' artificial intelligence race,1269vg8,7160,0,0.87,2023-03-29
32,Artificial intelligences and their defects,ydkmiu,6327,0,0.92,2022-10-25
33,Artificial Intelligence,7lnxml,12277,0,0.9,2017-12-23
34,Artists Are Suing Artificial Intelligence Companies and the Lawsuit Could Upend Legal Precedents Around Art,13gq49c,7955,0,0.94,2023-05-13
35,In the Face of Artificial Intelligence,12dp3bg,2830,0,0.92,2023-04-06
36,And they call it artificial “intelligence”—hah!,12t3azy,2314,0,0.95,2023-04-20
37,Google engineer thinks artificial intelligence bot has become sentient,vajoll,2803,0,0.77,2022-06-12
38,US launches artificial intelligence military use initiative,113vyj7,2560,0,0.96,2023-02-16
39,Artificial intelligence researchers must learn ethics,906jod,7969,0,0.88,2018-07-19
40,I accidentally created artificial intelligence in my Minecraft world,yw7muv,4910,0,0.98,2022-11-15
41,This is how Artificial Intelligence reviews movies.,14baqjr,2683,0,1.0,2023-06-16
42,Guillermo del Toro: ‘I Don’t Fear Artificial Intelligence. I Fear Natural Stupidity’,14l9w5s,8363,0,0.98,2023-06-28
43,"Move over, artificial intelligence. Scientists announce a new 'organoid intelligence' field",11ghzdi,1704,0,0.95,2023-03-02
44,Artificial Intelligence [OC],6qqu1g,5909,0,0.92,2017-07-31
45,"The Pentagon promises to use artificial intelligence for good, not evil",f9cr6g,42362,0,0.95,2020-02-25
46,'The Godfather of A.I.' warns of 'nightmare scenario' where artificial intelligence begins to seek power,135lc4j,5954,0,0.89,2023-05-02
47,TIMELINE Artificial Intelligence in Games,16p597v,640,0,0.84,2023-09-22
48,Elon Musk to speak at Russian conference on artificial intelligence,17up7ui,703,0,0.89,2023-11-13
49,"I had an artificial intelligence create a chess puzzle, but I can't solve it. What's the solution?",17aibq7,8848,0,0.97,2023-10-17
50,Robots and artificial intelligence rise. Robots and artificial intelligence rise. Robots and artificial intelligence rise. Robots and artificial intelligence rise. Robots and artificial intelligence rise. Robots and artificial intelligence rise. Robots and artificial intelligence rise. Robots and ar,scrrwo,1759,0,1.0,2022-01-25
51,"Extension created for ""The Milkmaid"" using artificial intelligence (Dall-E2)",z4ie1d,5212,0,0.95,2022-11-25
52,Tried to get a tinder date using artificial intelligence,yrt6p7,2150,0,0.92,2022-11-10
53,Artificial intelligence,tfb4rr,6376,0,0.96,2022-03-16
54,Chamber of Artificial Intelligence,13f5c6k,6020,0,0.96,2023-05-11
55,Stephen Hawking warns artificial intelligence could end mankind.,2o1kdn,11321,0,0.79,2014-12-02
56,Alan Turing creates Artificial Intelligence C.1950,ftgkg0,31968,0,0.96,2020-04-01
57,Artificial Intelligence police van detects drivers using mobile phones,15ekmn8,1379,0,0.95,2023-07-31
58,"Happy birthday to Alan Turing, the father of artificial intelligence!",o6e77g,14917,0,0.96,2021-06-23
59,The Future of Artificial Intelligence,uvgjem,5348,0,0.97,2022-05-22
60,[GIVEAWAY] Giving away 10 deskmats from the AI Collection! Every single design is generated by Artificial Intelligence,wddcpe,14556,0,0.93,2022-08-01
61,"'A Chernobyl for AI' looms if artificial intelligence is kept unchecked, says scientist Stuart Russell",12ihblu,4475,0,0.85,2023-04-11
62,artificial intelligence meets disney...,1043j4c,2087,0,0.96,2023-01-05
63,"Alan Turing - ""The father Artificial Intelligence""",e6ugox,9569,0,0.96,2019-12-05
64,"Donald Glover Opens Up About Next Career Chapter, Modern Rap, and Artificial Intelligence",16yepcj,1481,0,0.94,2023-10-02
65,"""Artificial Intelligence""",149o5wi,1036,0,0.97,2023-06-14
66,US patent office rules that artificial intelligence cannot legally be an inventor,gawn7m,23817,0,0.96,2020-04-30
67,Biden to sign sweeping artificial intelligence executive order,17jq6hp,414,0,0.97,2023-10-30
68,Robot uses artificial intelligence to cook burgers,9jdf94,14000,0,0.95,2018-09-27
69,Artificial intelligence stories done right,z8ury2,1971,0,0.99,2022-11-30
70,Artificial intelligence? Yea right..,131s7xy,1818,0,0.97,2023-04-28
71,Artificial “intelligence”,138kn8b,1088,0,0.82,2023-05-05
72,Pathfinder and Artificial Intelligence,11fe5ox,394,0,0.95,2023-03-01
73,The “not real” person the woman saw on the plane was a humanoid artificial intelligence,14r7ad3,1365,0,0.77,2023-07-05
74,Rwanda becomes first African country to launch centre dedicated to artificial intelligence | News24,u16alh,11950,0,0.96,2022-04-11
75,"German ad: ""Artificial intelligence: the 4 most used drinks will be placed on the main screen""",xi8k54,10756,0,0.96,2022-09-19
76,"Artificial intelligence could leave half the world unemployed, says expert",45l03x,8555,0,0.87,2016-02-13
77,"5000-Year-Old Tablets Can Now Be Decoded by Artificial Intelligence, New Research Reveals",185opxj,2227,0,0.95,2023-11-27
78,Artificial intelligence is now in full control of the game,v9zmbn,8255,0,0.99,2022-06-11
79,Artificial intelligence pioneer Geoffrey Hinton leaves Google over risks of emerging tech,134wy1t,2730,0,0.95,2023-05-01
80,The workers already replaced by artificial intelligence,14c4f7r,501,0,0.9,2023-06-17
81,There's No Such Thing as Artificial Intelligence | The term breeds misunderstanding and helps its creators avoid culpability.,122u11v,5623,0,0.9,2023-03-26
82,Artificial intelligence is breaking patent law,uxg0t4,2070,0,0.98,2022-05-25
83,Artificial intelligence identifies previously unknown features associated with cancer recurrence,eg7zub,12361,0,0.96,2019-12-27
84,"Tesla CEO Elon Musk says social media, artificial intelligence should be regulated",8bguzb,27508,0,0.86,2018-04-11
85,"Humans won't be able to control artificial intelligence, scientists warn",kx4vzr,3692,0,0.95,2021-01-14
86,Artificial intelligence turns brain activity into speech,ac16ce,4527,0,0.97,2019-01-02
87,"Artificial Intelligence Creates Realistic Photos of People, None of Whom Actually Exist",a9kbop,18026,0,0.89,2018-12-25
88,Evolution Of Civilisation by an Artificial Intelligence,12crz1g,1219,0,0.88,2023-04-05
89,artificialIntelligenceVsNaturalStupidity,156ra5w,1442,0,0.97,2023-07-22
90,What’s something that Artificial Intelligence will never be able to do?,1754pcu,414,0,0.87,2023-10-10
91,Natural stupidity will kill us faster than Artificial Intelligence,ef2qcf,14695,0,0.95,2019-12-24
92,Even artificial intelligence be on that bullshit,agn8mm,4531,0,0.88,2019-01-16
93,Artificial Intelligence Brings Mona Lisa to Life,hvpvaj,6745,0,0.97,2020-07-22
94,A.I.: Artificial Intelligence (2001),17kzelm,811,0,0.99,2023-10-31
95,"Richard Stallman's thoughts on ChatGPT, Artificial Intelligence and their impact on humanity",122gmm9,1394,0,0.89,2023-03-26
96,IBM will lay off thousands of employees. Their work will be taken over by artificial intelligence,137quii,2191,0,0.98,2023-05-04
97,The Problem with ‘Friendly’ Artificial Intelligence,7dm8hu,2812,0,0.9,2017-11-17
98,Artificial intelligence,15c2pfr,699,0,0.96,2023-07-28
99,Nasa to hold major announcement after artificial intelligence makes major planet-hunting breakthrough,7j1w9l,29802,0,0.91,2017-12-11
